{
  "name": "Operation Code Front-End",
  "description": "Re-implementation of Operation Code's front-end with best practices, SEO, and performance in mind.",
  "website": "https://operation-code.now.sh",
  "license": [
    {
      "spdx": "MIT",
      "licenseURL": "https://github.com/OperationCode/front-end/blob/master/LICENSE"
    }
  ],
  "SDGs": [
    {
      "SDGNumber": 4
    },
    {
      "SDGNumber": 10
    }
  ],
  "sectors": [],
  "type": [
    "software"
  ],
  "repositoryURL": "https://github.com/OperationCode/front-end",
  "organizations": [
    {
      "name": "Operation Code",
      "website": "https://www.operationcode.org",
      "org_type": "owner"
    }
  ],
  "stage": "nominee"
}
