{
  "name": "Green Button",
  "description": "Green Button is a secure way to get your energy usage information electronically.",
  "website": "https://green-button.github.io",
  "license": [
    {
      "spdx": "Apache-2.0",
      "licenseURL": "https://github.com/GreenButtonAlliance/OpenESPI-Common-java/blob/master/LICENSE"
    }
  ],
  "SDGs": [
    {
      "SDGNumber": 7
    }
  ],
  "sectors": [],
  "type": [
    "software"
  ],
  "repositoryURL": "https://github.com/GreenButtonAlliance/OpenESPI-Common-java",
  "organizations": [
    {
      "name": "Green Button Alliance",
      "website": "https://www.greenbuttonalliance.org/",
      "org_type": "owner"
    }
  ],
  "stage": "nominee"
}
