{
  "name": "Housing Vacancy Bot",
  "description": "A Telegram bot that allows housing officials/owners to report vacancy to a central source and allows health works/government officials to consume that information.",
  "website": "https://ethiocovid19rt.com/",
  "license": [
    {
      "spdx": "MIT",
      "licenseURL": "https://github.com/africa-covid-19-response-toolkit/housing-vacancy-bot/blob/master/LICENSE"
    }
  ],
  "SDGs": [
    {
      "SDGNumber": 3,
      "evidenceURL": "https://medium.com/africa-covid-19-response-toolkit/introducing-the-open-source-africa-covid-19-response-toolkit-6d4a571027a8"
    }
  ],
  "sectors": [],
  "type": [
    "software"
  ],
  "repositoryURL": "https://github.com/africa-covid-19-response-toolkit/housing-vacancy-bot/blob/master/LICENSE",
  "organizations": [
    {
      "name": "Ethiopia COVID-19 Response Team",
      "website": "https://ethiocovid19rt.com/",
      "org_type": "owner"
    }
  ],
  "stage": "nominee"
}
