{
  "name": "Apache cTAKES",
  "aliases": [
    "Apache clinical Text Analysis and Knowledge Extraction System"
  ],
  "description": "Apache cTAKES is a natural language processing system for extraction of information from electronic medical record clinical free-text.",
  "website": "http://ctakes.apache.org/",
  "license": [
    {
      "spdx": "Apache-2.0",
      "licenseURL": "https://github.com/apache/ctakes/blob/trunk/LICENSE"
    }
  ],
  "SDGs": [
    {
      "SDGNumber": 3,
      "evidenceURL": "https://www.openhealthnews.com/content/apachecon-2020-features-natural-language-processing-electronic-medical-records-dedicated-tra"
    },
    {
      "SDGNumber": 9,
      "evidenceURL": "https://www.openhealthnews.com/content/apachecon-2020-features-natural-language-processing-electronic-medical-records-dedicated-tra"
    }
  ],
  "type": [
    "software"
  ],
  "repositoryURL": "https://github.com/apache/ctakes",
  "organizations": [
    {
      "name": "The Apache Software Foundation",
      "website": "https://apache.org",
      "org_type": "owner"
    }
  ],
  "stage": "nominee"
}
