{
  "name": "HealthSites.io",
  "description": "Healthsites is a framework for capturing, publishing and sharing critical health and sanitation related data to help make these facilities more accessible and relevant to the communities they serve.",
  "website": "https://healthsites.io",
  "license": [
    {
      "spdx": "ODbL-1.0",
      "licenseURL": "https://github.com/healthsites/healthsites/blob/master/LICENSE-DATA.txt"
    },
    {
      "spdx": "BSD-3-Clause",
      "licenseURL": "https://github.com/healthsites/healthsites/blob/master/LICENSE-CODE.txt"
    }
  ],
  "SDGs": [
    {
      "SDGNumber": 3
    },
    {
      "SDGNumber": 16
    },
    {
      "SDGNumber": 17
    }
  ],
  "sectors": [],
  "type": [
    "software",
    "data"
  ],
  "repositoryURL": "https://github.com/healthsites/healthsites",
  "organizations": [
    {
      "name": "HealthSites.io",
      "website": "https://healthsites.io",
      "org_type": "owner"
    }
  ],
  "stage": "nominee"
}
