{
  "name": "Emoncms",
  "description": "Emoncms is an open-source web application for processing, logging and visualising energy, temperature and other environmental data.",
  "website": "https://emoncms.org/",
  "license": [
    {
      "spdx": "AGPL-3.0",
      "licenseURL": "https://github.com/emoncms/emoncms/blob/master/LICENSE.txt"
    }
  ],
  "SDGs": [
    {
      "SDGNumber": 7,
      "evidenceText": "Emoncms is an open-source web application for processing, logging and visualising energy, temperature and other environmental data. It is a part of the OpenEnergyMonitor project. It helps users understand energy, explore the context of renewable energy and zero carbon"
    }
  ],
  "sectors": [
    "Energy"
  ],
  "type": [
    "software"
  ],
  "repositoryURL": "https://github.com/emoncms/emoncms",
  "organizations": [
    {
      "name": "OpenEnergyMonitor",
      "website": "https://openenergymonitor.org/",
      "org_type": "owner"
    }
  ],
  "stage": "nominee"
}
