{
  "name": "Internal Dashboard",
  "description": "Internal dashboard for officials to get real time data and updates on COVID-19 on surveillance, case tracking, and monitoring.",
  "website": "https://ethiocovid19rt.com/",
  "license": [
    {
      "spdx": "MIT",
      "licenseURL": "https://github.com/africa-covid-19-response-toolkit/internal-dashboard/blob/master/LICENSE"
    }
  ],
  "SDGs": [
    {
      "SDGNumber": 3,
      "evidenceURL": "https://medium.com/africa-covid-19-response-toolkit/africa-covid-19-response-toolkit-dashboard-c5d872932a9"
    }
  ],
  "sectors": [],
  "type": [
    "software"
  ],
  "repositoryURL": "https://github.com/africa-covid-19-response-toolkit/internal-dashboard",
  "organizations": [
    {
      "name": "Ethiopia COVID-19 Response Team",
      "website": "https://ethiocovid19rt.com/",
      "org_type": "owner"
    }
  ],
  "stage": "nominee"
}
