{
  "name": "webpack",
  "description": "A bundler for javascript and friends. Packs many modules into a few bundled assets. Code Splitting allows for loading parts of the application on demand. Through \"loaders\", modules can be CommonJs, AMD, ES6 modules, CSS, Images, JSON, Coffeescript, LESS, ... and your custom stuff.",
  "website": "https://webpack.js.org/",
  "license": [
    {
      "spdx": "MIT",
      "licenseURL": "https://github.com/webpack/webpack/blob/master/LICENSE"
    }
  ],
  "SDGs": [
    {
      "SDGNumber": 9
    }
  ],
  "sectors": [
    "Digital/Data/Tech"
  ],
  "type": [
    "software"
  ],
  "repositoryURL": "https://github.com/webpack/webpack/",
  "organizations": [
    {
      "name": "webpack",
      "website": "https://webpack.js.org/",
      "org_type": "owner"
    }
  ],
  "stage": "nominee"
}
