{
    "name": "ACRT Surveillance Form",
    "description": "Online forms for reporting rumored COVID-19 cases.",
    "website": "http://forms.ethiopia-covid19.com/",
    "license": [
      {
        "spdx": "MIT",
        "licenseURL": "https://github.com/africa-covid-19-response-toolkit/surveillance-forms/blob/master/LICENSE"
      }
    ],
    "SDGs": [
      {
        "SDGNumber": 3,
        "evidenceURL": "https://medium.com/africa-covid-19-response-toolkit/introducing-the-open-source-africa-covid-19-response-toolkit-6d4a571027a8"
      }
    ],
    "type": [
      "software"
    ],
    "repositoryURL": "https://github.com/africa-covid-19-response-toolkit/surveillance-forms",
    "organizations": [
      {
        "name": "Ethiopia COVID-19 Response Team",
        "website": "https://ethiocovid19rt.com/",
        "org_type": "owner",
        "contact_email": "acrt@ethiocovid19rt.com"
      }
    ],
    "stage": "nominee"
  }