{
  "name": "Octopus Microfinance",
  "description": "Comprehensive Management Information Systems (MIS) for Microfinance: loans and savings portfolio management, interactive client relationship management, integrated accounting and proactive risk management.",
  "website": "https://sourceforge.net/projects/omfs/",
  "license": [
    {
      "spdx": "LGPL-3.0",
      "licenseURL": "https://sourceforge.net/projects/omfs/"
    }
  ],
  "SDGs": [
    {
      "SDGNumber": 16
    },
    {
      "SDGNumber": 17
    }
  ],
  "sectors": [],
  "type": [
    "software"
  ],
  "repositoryURL": "https://sourceforge.net/projects/omfs/",
  "organizations": [
    {
      "name": "Octopus Microfinance",
      "website": "https://sourceforge.net/projects/omfs/",
      "org_type": "owner"
    }
  ],
  "stage": "nominee"
}
